{
  "$schema": "https://json-schema.org/draft/2020-12/schema",
  "$id": "https://open-content-engine.example/schemas/artifacts/learning-record.schema.json",
  "title": "Learning Record",
  "description": "A first-class, reviewable record of a proposed change derived from reviewer feedback (release-spec.md §7.10; model §2; DD-6). Learning is never in-place mutation: a record captures the signals it was derived from, the artifact it targets, that artifact's mutability class (recorded before apply), the proposed diff, and a status. In v1 records are created (proposed) and applied by a human only; application snapshots the instance repo and a rollback ref enables one-step revert. Records that target human-only artifacts (guardrail/safety rules) are refused by the application tool. All refs are $CONTENT_HOME-relative or instance-repo commit refs; absolute paths are forbidden. Structural contract only; instances are instance data and never ship in the repo.",
  "x-stability": "experimental",
  "type": "object",
  "additionalProperties": false,
  "required": [
    "id",
    "created_at",
    "source_signals",
    "target_artifact",
    "target_mutability",
    "proposed_diff",
    "status"
  ],
  "properties": {
    "id": {
      "type": "string",
      "description": "Stable identifier for the learning record."
    },
    "created_at": {
      "type": "string",
      "format": "date-time",
      "description": "When the record was created."
    },
    "source_signals": {
      "type": "array",
      "minItems": 1,
      "description": "The reviewer/analytics signals the proposal was derived from. Minimum-signal thresholds apply (DD-6); a single-signal (n=1) proposal is flagged.",
      "items": {
        "type": "object",
        "additionalProperties": false,
        "required": ["type", "count"],
        "properties": {
          "type": {
            "type": "string",
            "enum": ["rejection", "edit", "analytics", "calibration"],
            "description": "Kind of signal."
          },
          "refs": {
            "type": "array",
            "items": { "type": "string" },
            "description": "$CONTENT_HOME-relative references to the source artifacts (decisions, reports, calibration runs)."
          },
          "count": {
            "type": "integer",
            "minimum": 1,
            "description": "Number of occurrences supporting the signal; count=1 is flagged per DD-6."
          }
        }
      }
    },
    "target_artifact": {
      "type": "string",
      "description": "Identifier of the artifact the change targets (e.g. a rule id, brand DNA file, or config key)."
    },
    "target_mutability": {
      "type": "string",
      "enum": ["human-only", "learnable"],
      "description": "Mutability class of the target, recorded before apply (model §3 rule 4). human-only targets are refused by the application tool."
    },
    "proposed_diff": {
      "type": "string",
      "description": "The proposed change as a diff against the target artifact."
    },
    "status": {
      "type": "string",
      "enum": ["proposed", "applied", "rolled_back"],
      "description": "Lifecycle of the record."
    },
    "applied_by": {
      "type": "string",
      "description": "Identifier of the human who applied the change (human-only in v1; machine application is roadmap). Present once status is applied."
    },
    "applied_at": {
      "type": "string",
      "format": "date-time",
      "description": "When the change was applied. Present once status is applied."
    },
    "rollback_ref": {
      "type": "string",
      "description": "Instance-repo commit ref captured before application, enabling one-step rollback (DD-6). Present once status is applied."
    },
    "shareability": {
      "type": "string",
      "enum": ["private", "candidate-for-upstream"],
      "default": "private",
      "description": "Whether the record's diff is a candidate for a sanitized opt-in upstream PR (DD-7(b)); no automated transmission exists in v1."
    }
  },
  "allOf": [
    {
      "if": {
        "properties": { "status": { "const": "applied" } }
      },
      "then": {
        "required": ["applied_by", "applied_at", "rollback_ref"]
      }
    }
  ]
}
